Time,Pitch 1,Pitch 2,Pitch 3
10:00,Blackheath 1 v Old Elthamians 3,Tonbridge Juddians 1 v Westcombe Park 2,Hampstead 2 v Old Alleynians RFC
10:40,Old Elthamians 3 v Tonbridge Juddians 1,Hampstead 2 v Westcombe Park 2,Blackheath 1 v Old Alleynians RFC
11:20,Old Elthamians 3 v Westcombe Park 2,Old Alleynians RFC v Tonbridge Juddians 1,Blackheath 1 v Hampstead 2
12:00,Blackheath 1 v Westcombe Park 2,Hampstead 2 v Tonbridge Juddians 1,Old Alleynians RFC v Old Elthamians 3
12:40,Hampstead 2 v Old Elthamians 3,Old Alleynians RFC v Westcombe Park 2,Blackheath 1 v Tonbridge Juddians 1
